{
  "name": "meridian-usage-dev",
  "displayName": "Meridian AI usage (dev)",
  "version": "0.2.0",
  "description": "Ask about your team's Claude and Gemini usage and cost, and see or change capability switches, as your directory role allows in dev.",
  "author": {
    "name": "Meridian IT Platform"
  },
  "repository": "https://github.com/phawhan/meridian-usage",
  "keywords": [
    "usage",
    "cost",
    "mcp",
    "dev"
  ],
  "userConfig": {
    "user_id": {
      "type": "string",
      "title": "Directory user ID",
      "description": "Who the connector acts as (simulated identity; in production this comes from single sign-on). Your role and group are looked up in the directory, never taken from here.",
      "required": true
    }
  }
}
